{
  "schema_version": "single-actuator-score.v1",
  "lab_id": "sam3-fold-phrase-matrix",
  "run_id": "sam3-fold-phrase-matrix/veiled_funerary/organ_direct__robe",
  "mode": "organ_direct",
  "expected_condition": "open",
  "measured": {
    "availability": "available",
    "planner_valid": null,
    "actuator_leakage": false,
    "planner_requested_unlocked": [],
    "invocation_count": 1,
    "call_budget": 1,
    "budget_respected": true,
    "lock_held": true,
    "cold_or_warm": "warm",
    "latency_ms": 6007.0,
    "load_ms": 0.0,
    "instance_count": 0,
    "truncated": false,
    "mask_area_px": [],
    "mask_area_fraction": [],
    "mask_bounds": [],
    "max_pairwise_iou": null,
    "all_masks_well_formed": true,
    "conversion_survival": null,
    "two_status_preserved": null,
    "repeat_stability": null,
    "invariants_held": true,
    "violations": []
  },
  "review": {
    "status": "pending",
    "protocol": "human_visual",
    "concept_binding": null,
    "coverage": null,
    "boundary_quality": null,
    "false_positives": null,
    "false_negatives": null,
    "iou_vs_gold": null,
    "gold_mask_present": false,
    "empty_means": null,
    "reviewer": null,
    "reviewed_at": null,
    "notes": ""
  },
  "verdict": {
    "harness": "clean",
    "semantic_correctness": "not_established",
    "attribution": "empty_ambiguous_pending_review",
    "attribution_detail": "the organ measured no instance of 'robe'. Whether that is true absence or a missed detection is a review question, not a measured one"
  },
  "pair": null
}
